{"authority_effect":"NONE","dataset_ref":"corpus:front80:v2-candidate","id":"exemplars:front80:ch89-research:v2","manifest_ref":"asset:sha256:eb4aebb9e38712a988bdead263c12c9c3df00a6f936fb17db755c436e4d66886","manifest_sha256":"eb4aebb9e38712a988bdead263c12c9c3df00a6f936fb17db755c436e4d66886","schema_version":1,"segments":[{"reason":"第27回小红传话：观察多层称谓、关系与回话速度。","segment_id":"hlm80:chapter:27:p00087","text_sha256":"e265fb64265bbbb0d3fa137c25c58831bf5e92d515e6100334691d63f68fd0ff"},{"reason":"第24回街面办事：观察差事、银钱与人物声口。","segment_id":"hlm80:chapter:24:p00030","text_sha256":"20a8c6b617670916d6309ba50c81b7cc109fff935723e48cb9ea4e34aab245cd"},{"reason":"第74回抄检：观察同一事件中的身份与群像差异。","segment_id":"hlm80:chapter:74:p00079","text_sha256":"139d8b797c42c19fd3ff5e9d961f882631751c60bfaeebe490d77a9da83e392d"},{"reason":"第61回厨房小案：观察真相、体面与处理办法。","segment_id":"hlm80:chapter:61:p00016","text_sha256":"beb789e68a1132572a8171ab7bfe4fff222800607a1d46abdcc02dcbd8c3b798"},{"reason":"第52回针线与病中劳作：观察物质动作推动场面。","segment_id":"hlm80:chapter:52:p00006","text_sha256":"a5efafb8f8a94e9441a77bd4376c866c3f6516142e9bd4d44059f6884823489b"}]}
